{
  "title": "南堀江3LDKは上がるのか？3分プレゼン",
  "tags": ["プレゼンMVP", "南堀江3LDK", "不動産価格"],
  "description": "大阪市西区・南堀江の3LDKマンション価格見通しを、要因分解とシナリオで解説する約3分のサンプル台本。",
  "character": {
    "image_path": "../assets/character_rabbit.png",
    "position": { "x": 1240, "y": 280 },
    "scale": 0.95
  },
  "background_defaults": {
    "prompt": "cozy pastel home office, flat illustration, soft lighting, wide angle, 16:9",
    "change_interval_seconds": 120
  },
  "scenes": [
    {
      "id": "S001",
      "narration": "ようこそ。テーマは『大阪市西区・南堀江の3LDKマンションは上がるのか』です。結論先出しで言うと、需給と立地の強さから、緩やかな上昇から横ばいのレンジがメインシナリオです。",
      "subtitle_lines": [
        "ようこそ。",
        "テーマは『大阪市西区・南堀江の3LDKマンションは上がるのか』です。",
        "結論先出しで言うと、需給と立地の強さから、緩やかな上昇から横ばいのレンジがメインシナリオです。"
      ],
      "panel": {
        "title": "先に結論",
        "body": [
          "本線：緩やかな上昇〜横ばいレンジ",
          "上振れ要因：立地・ブランド力・希少性",
          "下振れ要因：金利上昇・供給サイクル・家計実質負担"
        ],
        "conclusion": "短期の上下はあっても、中期は堅調寄りの見通し。"
      },
      "background_prompt": "pastel city skyline of Osaka, riverfront, flat illustration, warm evening light, 16:9"
    },
    {
      "id": "S002",
      "narration": "まず現状を整理します。南堀江は都心近接で生活利便とライフスタイル資産の両立が特徴。3LDKは供給が少なく、ファミリー・DINKsの実需に支えられます。",
      "subtitle_lines": [
        "まず現状を整理します。",
        "南堀江は都心近接で生活利便とライフスタイル資産の両立が特徴。",
        "3LDKは供給が少なく、ファミリー・DINKsの実需に支えられます。"
      ],
      "panel": {
        "title": "南堀江の現在地",
        "body": [
          "都心アクセス良好・生活導線が短い",
          "カフェ・家具・ファッションの通りで人気",
          "3LDKは希少在庫になりやすい"
        ],
        "conclusion": "『場所×暮らしやすさ』が価格の粘りを生む。"
      },
      "background_prompt": "minimalist map of Nishi-ku Osaka, gentle colors, 16:9 illustration"
    },
    {
      "id": "S003",
      "narration": "価格形成の第1要因は立地力です。難波・心斎橋・堀江エリアの回遊性、河川沿いの雰囲気、公園や学校などの生活インフラが評価されます。",
      "subtitle_lines": [
        "価格形成の第1要因は立地力です。",
        "難波・心斎橋・堀江エリアの回遊性、河川沿いの雰囲気、公園や学校などの生活インフラが評価されます。"
      ],
      "panel": {
        "title": "立地評価ポイント",
        "body": [
          "都心商業地への近さと自転車圏の回遊性",
          "リバーサイド景観や散歩導線の快適性",
          "公園・学校・日常買いの網羅度"
        ],
        "conclusion": "日々の『移動時間が短い』は資産価値に直結。"
      }
    },
    {
      "id": "S004",
      "narration": "第2要因は供給と在庫です。都心部の3LDKは新規供給が限定的で、広さ確保のコストが上がりやすい。築古からの住み替え需要も底支えになります。",
      "subtitle_lines": [
        "第2要因は供給と在庫です。",
        "都心部の3LDKは新規供給が限定的で、広さ確保のコストが上がりやすい。",
        "築古からの住み替え需要も底支えになります。"
      ],
      "panel": {
        "title": "供給・在庫の見方",
        "body": [
          "都心3LDKの新規供給は相対的に少なめ",
          "分譲コスト・建築費の上昇圧力",
          "築古→築浅への住み替え需要が恒常的"
        ],
        "conclusion": "希少性が価格の“下支え”として機能。"
      },
      "background_prompt": "flat illustration of construction cranes and condos, soft tones, 16:9"
    },
    {
      "id": "S005",
      "narration": "第3要因はマクロ環境。金利はローン負担に直結し、為替は海外投資家の見方に影響。賃金動向や物価も家計の実力値を左右します。",
      "subtitle_lines": [
        "第3要因はマクロ環境。",
        "金利はローン負担に直結し、為替は海外投資家の見方に影響。",
        "賃金動向や物価も家計の実力値を左右します。"
      ],
      "panel": {
        "title": "マクロのチェック項目",
        "body": [
          "住宅ローン金利：上昇なら価格上昇を抑制",
          "為替：海外資金の流入・選好に影響",
          "実質賃金：家計の“支払余力”を規定"
        ],
        "conclusion": "金利と家計のバランスが短中期の鍵。"
      }
    },
    {
      "id": "S006",
      "narration": "第4要因は賃貸需給です。都心3LDKは自用だけでなく、手堅い賃貸需要にも支えられます。空室率の低さは資産の安定性につながります。",
      "subtitle_lines": [
        "第4要因は賃貸需給です。",
        "都心3LDKは自用だけでなく、手堅い賃貸需要にも支えられます。",
        "空室率の低さは資産の安定性につながります。"
      ],
      "panel": {
        "title": "賃貸サイドの示唆",
        "body": [
          "ファミリー・DINKs・法人社宅の需要層",
          "立地・学校区・生活導線のわかりやすさ",
          "売却せず賃貸化の選択肢がリスク低減"
        ],
        "conclusion": "出口戦略の選択肢が多いほど価格は粘る。"
      },
      "background_prompt": "apartment interior 3LDK plan abstract, clean flat illustration, 16:9"
    },
    {
      "id": "S007",
      "narration": "一方でリスクも把握しておきましょう。金利急上昇、周辺の大量供給、修繕コストの想定外上昇、ハザードリスクなどです。",
      "subtitle_lines": [
        "一方でリスクも把握しておきましょう。",
        "金利急上昇、周辺の大量供給、修繕コストの想定外上昇、ハザードリスクなどです。"
      ],
      "panel": {
        "title": "チェックすべきリスク",
        "body": [
          "金利ショック：月々返済と買い手層を直撃",
          "エリア一帯の大量供給で一時的な需給緩み",
          "大規模修繕費・管理費の上振れ",
          "浸水・液状化などハザード要因"
        ],
        "conclusion": "物件個別の『管理・修繕・積立』は精査必須。"
      }
    },
    {
      "id": "S008",
      "narration": "最後にシナリオです。ベースは緩やかな上昇〜横ばい。金利緩やか・供給限定なら上振れ。金利上昇・供給増なら一時調整後に選別が進む見立てです。",
      "subtitle_lines": [
        "最後にシナリオです。",
        "ベースは緩やかな上昇〜横ばい。",
        "金利緩やか・供給限定なら上振れ。",
        "金利上昇・供給増なら一時調整後に選別が進む見立てです。"
      ],
      "panel": {
        "title": "シナリオとアクション",
        "body": [
          "ベース：需給均衡でじわ上げ or 横ばい",
          "上振れ：金利安定＋3LDK希少性で強含み",
          "下振れ：金利上昇・供給増で一時調整→良質物件へ選別"
        ],
        "conclusion": "行動指針：管理良好・騒音少・眺望/採光/導線◎の3LDKを狙う。"
      },
      "background_prompt": "clean business slide with scenario arrows up and down, flat style, 16:9"
    }
  ]
}
